{
  "version": "0.1",
  "sceneId": "vertical-slice-001",
  "spawn": {"position": {"x": 0, "y": 3, "z": 0}, "rotation": {"x": 0, "y": 0, "z": 0}},
  "parts": [
    {"id": "StartPlatform", "role": "platform", "shape": "Block", "transform": {"position": {"x": 0, "y": 0, "z": 0}, "rotation": {"x": 0, "y": 0, "z": 0}}, "size": {"x": 24, "y": 2, "z": 24}, "color": "#1F2937", "material": "SmoothPlastic", "collision": true},
    {"id": "JumpPlatform01", "role": "platform", "shape": "Block", "transform": {"position": {"x": 0, "y": 3, "z": 18}, "rotation": {"x": 0, "y": 0, "z": 0}}, "size": {"x": 10, "y": 2, "z": 10}, "color": "#22D3EE", "material": "SmoothPlastic", "collision": true},
    {"id": "Checkpoint01", "role": "checkpoint", "shape": "Block", "transform": {"position": {"x": 0, "y": 6, "z": 34}, "rotation": {"x": 0, "y": 0, "z": 0}}, "size": {"x": 12, "y": 1, "z": 12}, "color": "#FACC15", "material": "Neon", "collision": true},
    {"id": "FinishPlatform", "role": "finish", "shape": "Block", "transform": {"position": {"x": 0, "y": 10, "z": 52}, "rotation": {"x": 0, "y": 0, "z": 0}}, "size": {"x": 18, "y": 2, "z": 18}, "color": "#D946EF", "material": "SmoothPlastic", "collision": true}
  ]
}
